{"$schema":"../../docs/project/schema/v2-m22-followup-manifest.schema.json","acceptance":{"case_count":42,"competition":"complete public-state score and failure outcome for every opponent case; universal victory is not required","every_case_retained":true,"minimum_replicates_per_service_mode":2,"required_climates":["temperate","arctic","tropic","toyland"],"required_map_sizes":[[64,64],[128,128],[512,128],[1024,1024]],"required_opponents":["AAAHogEx","KrakenAI2","NoOpAI"],"required_transport_modes":["road","rail","water","air","multimodal","company","broad"],"retention":"every selected G15-G21 program passes its native gate oracle without a missing case","service":"positive native delivery and income in every road, rail, water, air, and multimodal service case","statistics":"seed-level mean, median, full range, Student-t 95 percent interval, failures and paired baseline effects","training_reward_is_not_acceptance":true},"access_policy":{"case_execution":"one-fresh-evaluator-and-one-network-unshared-native-dispatch-per-case","development_selection":"forbidden","final_v1_cases":"never-retried-replaced-or-relabeled","final_v1_evidence":"immutable-fail-preserved","followup_runner":"fresh-process-read-only-once-after-source-freeze","policy_input":"case-public-state-only-never-seed-or-required-program","post_result_selection":false,"replacement":0,"retry":0,"training":"forbidden"},"cases":[{"cargo":"PASS","case_id":"followup-road-passenger-64","climate":"temperate","map_height":64,"map_width":64,"native_probe":"m15-competence","opponent":"not-applicable","required_program":"road-passenger","seed":698564641,"source_gate":"G15","task":"service","transport_mode":"road"},{"cargo":"PASS","case_id":"followup-road-passenger-128","climate":"temperate","map_height":128,"map_width":128,"native_probe":"m15-competence","opponent":"not-applicable","required_program":"road-passenger","seed":1783180674,"source_gate":"G15","task":"service","transport_mode":"road"},{"cargo":"PASS","case_id":"followup-road-passenger-512x128","climate":"temperate","map_height":128,"map_width":512,"native_probe":"m15-competence","opponent":"not-applicable","required_program":"road-passenger","seed":1514135408,"source_gate":"G15","task":"service","transport_mode":"road"},{"cargo":"PASS","case_id":"followup-road-passenger-1024","climate":"temperate","map_height":1024,"map_width":1024,"native_probe":"m15-competence","opponent":"not-applicable","required_program":"road-passenger","seed":182396127,"source_gate":"G15","task":"service","transport_mode":"road"},{"cargo":"MAIL","case_id":"followup-road-cargo-temperate-mail","climate":"temperate","map_height":64,"map_width":64,"native_probe":"single-leg","opponent":"not-applicable","required_program":"road-cargo","seed":670248537,"source_gate":"G16","task":"service","transport_mode":"road"},{"cargo":"COAL","case_id":"followup-road-cargo-temperate-coal","climate":"temperate","map_height":64,"map_width":64,"native_probe":"industry-chain","opponent":"not-applicable","required_program":"road-cargo","seed":75636152,"source_gate":"G16","task":"service","transport_mode":"road"},{"cargo":"MAIL","case_id":"followup-road-cargo-arctic-mail","climate":"arctic","map_height":64,"map_width":64,"native_probe":"single-leg","opponent":"not-applicable","required_program":"road-cargo","seed":1432869936,"source_gate":"G16","task":"service","transport_mode":"road"},{"cargo":"FOOD","case_id":"followup-road-cargo-arctic-food","climate":"arctic","map_height":64,"map_width":64,"native_probe":"industry-chain","opponent":"not-applicable","required_program":"road-cargo","seed":1137239215,"source_gate":"G16","task":"service","transport_mode":"road"},{"cargo":"MAIL","case_id":"followup-road-cargo-tropic-mail","climate":"tropic","map_height":64,"map_width":64,"native_probe":"single-leg","opponent":"not-applicable","required_program":"road-cargo","seed":1983943076,"source_gate":"G16","task":"service","transport_mode":"road"},{"cargo":"MAIZ","case_id":"followup-road-cargo-tropic-maize","climate":"tropic","map_height":64,"map_width":64,"native_probe":"industry-chain","opponent":"not-applicable","required_program":"road-cargo","seed":611269123,"source_gate":"G16","task":"service","transport_mode":"road"},{"cargo":"MAIL","case_id":"followup-road-cargo-toyland-mail","climate":"toyland","map_height":64,"map_width":64,"native_probe":"single-leg","opponent":"not-applicable","required_program":"road-cargo","seed":588119761,"source_gate":"G16","task":"service","transport_mode":"road"},{"cargo":"SUGR","case_id":"followup-road-cargo-toyland-sugar","climate":"toyland","map_height":64,"map_width":64,"native_probe":"industry-chain","opponent":"not-applicable","required_program":"road-cargo","seed":235853665,"source_gate":"G16","task":"service","transport_mode":"road"},{"cargo":"PASS","case_id":"followup-rail-passenger-a","climate":"temperate","map_height":64,"map_width":64,"native_probe":"passenger","opponent":"not-applicable","required_program":"rail-passenger","seed":1413486222,"source_gate":"G17","task":"service","transport_mode":"rail"},{"cargo":"PASS","case_id":"followup-rail-passenger-b","climate":"temperate","map_height":64,"map_width":64,"native_probe":"passenger","opponent":"not-applicable","required_program":"rail-passenger","seed":1347660430,"source_gate":"G17","task":"service","transport_mode":"rail"},{"cargo":"COAL","case_id":"followup-rail-freight-a","climate":"temperate","map_height":64,"map_width":64,"native_probe":"freight","opponent":"not-applicable","required_program":"rail-freight","seed":1169680052,"source_gate":"G17","task":"service","transport_mode":"rail"},{"cargo":"COAL","case_id":"followup-rail-freight-b","climate":"temperate","map_height":64,"map_width":64,"native_probe":"freight","opponent":"not-applicable","required_program":"rail-freight","seed":1809951034,"source_gate":"G17","task":"service","transport_mode":"rail"},{"cargo":"PASS","case_id":"followup-ship-natural-passenger","climate":"temperate","map_height":64,"map_width":64,"native_probe":"natural","opponent":"not-applicable","required_program":"ship-natural","seed":1475220784,"source_gate":"G18","task":"service","transport_mode":"water"},{"cargo":"COAL","case_id":"followup-ship-natural-freight","climate":"temperate","map_height":64,"map_width":64,"native_probe":"natural","opponent":"not-applicable","required_program":"ship-natural","seed":776055562,"source_gate":"G18","task":"service","transport_mode":"water"},{"cargo":"PASS","case_id":"followup-ship-constructed-passenger","climate":"temperate","map_height":64,"map_width":64,"native_probe":"constructed","opponent":"not-applicable","required_program":"ship-constructed","seed":414210855,"source_gate":"G18","task":"service","transport_mode":"water"},{"cargo":"COAL","case_id":"followup-ship-constructed-freight","climate":"temperate","map_height":64,"map_width":64,"native_probe":"constructed","opponent":"not-applicable","required_program":"ship-constructed","seed":838823208,"source_gate":"G18","task":"service","transport_mode":"water"},{"cargo":"PASS","case_id":"followup-air-airplane-passenger","climate":"temperate","map_height":64,"map_width":64,"native_probe":"service","opponent":"not-applicable","required_program":"air-service","seed":1903298168,"source_gate":"G19","task":"service","transport_mode":"air"},{"cargo":"GOOD","case_id":"followup-air-airplane-goods","climate":"temperate","map_height":64,"map_width":64,"native_probe":"service","opponent":"not-applicable","required_program":"air-service","seed":840553542,"source_gate":"G19","task":"service","transport_mode":"air"},{"cargo":"PASS","case_id":"followup-air-helicopter-passenger","climate":"temperate","map_height":64,"map_width":64,"native_probe":"helicopter","opponent":"not-applicable","required_program":"air-helicopter","seed":623885541,"source_gate":"G19","task":"service","transport_mode":"air"},{"cargo":"MAIL","case_id":"followup-air-helicopter-mail","climate":"temperate","map_height":64,"map_width":64,"native_probe":"helicopter","opponent":"not-applicable","required_program":"air-helicopter","seed":1390948341,"source_gate":"G19","task":"service","transport_mode":"air"},{"cargo":"PASS","case_id":"followup-multimodal-passenger-a","climate":"temperate","map_height":64,"map_width":64,"native_probe":"multimodal","opponent":"not-applicable","required_program":"multimodal-transfer","seed":1669105137,"source_gate":"G19","task":"routing","transport_mode":"multimodal"},{"cargo":"PASS","case_id":"followup-multimodal-passenger-b","climate":"temperate","map_height":64,"map_width":64,"native_probe":"multimodal","opponent":"not-applicable","required_program":"multimodal-transfer","seed":1887915047,"source_gate":"G19","task":"routing","transport_mode":"multimodal"},{"cargo":"PASS","case_id":"followup-multimodal-router-a","climate":"temperate","map_height":64,"map_width":64,"native_probe":"router","opponent":"not-applicable","required_program":"mode-router","seed":1448505178,"source_gate":"G19","task":"routing","transport_mode":"multimodal"},{"cargo":"PASS","case_id":"followup-multimodal-router-b","climate":"temperate","map_height":64,"map_width":64,"native_probe":"router","opponent":"not-applicable","required_program":"mode-router","seed":757226542,"source_gate":"G19","task":"routing","transport_mode":"multimodal"},{"cargo":"PASS","case_id":"followup-competition-aaahogex-a","climate":"temperate","map_height":128,"map_width":128,"native_probe":"head-to-head","opponent":"AAAHogEx","required_program":"competition-head-to-head","seed":1649122539,"source_gate":"G20","task":"competition","transport_mode":"company"},{"cargo":"PASS","case_id":"followup-competition-aaahogex-b","climate":"temperate","map_height":128,"map_width":128,"native_probe":"head-to-head","opponent":"AAAHogEx","required_program":"competition-head-to-head","seed":1783600824,"source_gate":"G20","task":"competition","transport_mode":"company"},{"cargo":"PASS","case_id":"followup-competition-krakenai2-a","climate":"temperate